{
  "title": "论拓扑在ML训练性能中的作用",
  "event_hint": "ML训练网络拓扑 Clos与torus解析对比 集合通信完成时间受规模/失败/放置影响",
  "problem": "大规模ML训练部署在两类拓扑（胖树Clos与环面torus）上，但缺乏对二者在考虑放置、链路失败与交换机增强能力时的解析级性能比较；设计者缺少基于工作负载可达性能的拓扑选择依据。",
  "mechanism": "论文用alpha-beta（Hockney）模型推导AllReduce/AllGather/AlltoAll三类集合通信在Clos与torus上的完成时间下界（Table 2），并扩展到链路失败与作业放置场景；用消息投递模型分析规模、链路带宽与torus维度对完成时间的影响，并将模型应用于现代LLM训练案例。",
  "evidence": [
    {
      "claim": "不存在单一主导拓扑：Clos在多数情况下取得更优的集合完成时间，并提供弹性与灵活性；但torus在AllGather上因额外接入带宽始终更优",
      "value": "Clos多数更优",
      "baseline": "torus",
      "condition": "默认参数（400Gbps、3-D torus、radix128）",
      "source_locator": "chunk fac72fb517e5525d1aa4d67d-01.md，摘要与Page 3 Baseline Comparison"
    },
    {
      "claim": "小规模时torus常优于或接近Clos（高局部性使直径小）；随n增大Clos在除AllGather外所有集合上最终更优",
      "value": null,
      "baseline": null,
      "condition": "参与集合的节点数n增大",
      "source_locator": "chunk fac72fb517e5525d1aa4d67d-01.md，Page 3 Takeaway"
    },
    {
      "claim": "以现实带宽比rb=0.5（torus链路为Clos一半带宽）衡量：AllReduce在大规模更应在Clos，AlltoAll仅小n（约<50）时torus更优，AllGather始终torus更优",
      "value": "rb=0.5",
      "baseline": null,
      "condition": "近期TPU/GPU每链路带宽",
      "source_locator": "chunk fac72fb517e5525d1aa4d67d-01.md，Page 4 Varying Bandwidth段"
    },
    {
      "claim": "AllReduce受时延约束（Clos递归加倍log2(n)传输，torus受直径约束），AllGather/AlltoAll更受带宽约束；AllGather受接入带宽而非整体网络带宽约束",
      "value": null,
      "baseline": null,
      "condition": "解析模型",
      "source_locator": "chunk fac72fb517e5525d1aa4d67d-01.md，Page 4-5 Per-Collective Explanation"
    }
  ],
  "evaluation_context": "为解析模型而非实测：参数取现实默认（链路时延1µs、带宽400Gbps、消息100MB、3-D torus、radix128）；以CCT为主指标，并给出等完成时间所需带宽比rb与LLM案例研究。模型忽略排队/拥塞控制等细粒度传输层细节。",
  "limitations": "store-and-forward与最优路由、单一集合在网等简化假设；未涵盖功耗、硬件布局、其他Clos变体、rail优化与重配置；放置假设为最大局部性，非局部放置时小规模结论会改变；解析结论需实测集群验证。",
  "project_relevance": "属AI Infra横向的GPU集群与互联：为Clos vs torus的拓扑选择提供可复核的解析框架与边界条件，直接影响训练集合通信的完成时间与弹性设计判断。",
  "primary_source_resolved": true,
  "quality_score": 80,
  "source_notes": [
    "arXiv原文（2608.01707v1）已抓取，证据可在PDF Page 1-5定位。",
    "结论为解析推导（alpha-beta模型），非生产实测；rb=0.5基于近期TPU/GPU每链路带宽。"
  ]
}