{
  "title": "Speculate While You Reason: Teaching Agents to Predict Their Next Tool Call via Joint Agent–Speculator RL",
  "event_hint": "单模型自推测 Agent 通过联合强化学习预测并预执行下一次工具调用",
  "problem": "Agent 经常在远程搜索、数据库或 API 等工具返回期间等待。既有工具调用推测通常依赖额外草稿模型或历史轨迹，其预测分布与实际部署 Agent 不一致，并额外占用模型权重和 KV Cache；只有工具名和完整参数都与 Agent 最终调用一致时，预执行结果才能复用。",
  "mechanism": "论文让同一个模型承担 Agent 与 Speculator 两种模式：Agent 正常生成推理和工具调用，Speculator 在共享轨迹前缀后追加固定后缀，从部分轨迹预测下一条结构化调用，因此可复用 Agent 的前缀 KV Cache。训练时从当前策略的新鲜 Agent rollout 构造“前缀—实际下一调用”配对，并以 4 次 Agent 更新、8 次 Speculator 更新交替执行 DAPO 风格强化学习；模式切换时重置优化器，并用混合 SFT 预热稳定双模式行为。",
  "evidence": [
    {
      "claim": "联合强化学习将 Qwen3-4B 的平均下一工具调用精确 Hit@1 从 44.1 提升到 61.2。",
      "value": "44.1 -> 61.2 Hit@1",
      "baseline": "同一 4B 模型经过双模式 SFT、尚未进行联合 RL 的检查点",
      "condition": "HotpotQA、MuSiQue、BrowseComp-Plus、τ-bench Airline 和 Retail 五个评测；工具名与完整参数字典必须完全匹配",
      "source_locator": "Section 4.2, Table 2"
    },
    {
      "claim": "Qwen3.5-4B 的平均下一调用 Hit@1 从 48.9 提升到 66.3。",
      "value": "48.9 -> 66.3 Hit@1",
      "baseline": "同一 4B 模型的双模式 SFT 检查点",
      "condition": "同一五项搜索问答与会话式工具调用评测，采用结构化调用精确匹配",
      "source_locator": "Section 4.2, Table 2"
    },
    {
      "claim": "提升推测准确率的同时，平均任务成功率未下降：两个模型系列分别由 26.6 升至 27.7、49.2 升至 50.6。",
      "value": "26.6->27.7; 49.2->50.6",
      "baseline": "对应 SFT 检查点的平均任务成功率",
      "condition": "匹配域评测；每个模型系列在五个下游任务上取平均",
      "source_locator": "Section 4.2, Table 2"
    },
    {
      "claim": "在 MuSiQue 的 Qwen3-4B 在线对比中，自推测为 8.3 秒和 8.70GB，而 0.6B 外部草稿模型为 27.4 秒和 10.71GB。",
      "value": "8.3s/8.70GB vs 27.4s/10.71GB",
      "baseline": "Qwen3-0.6B 外部 Speculator 与 4B Agent 串行切换",
      "condition": "50 个 MuSiQue 查询、单张 H100、SGLang；时间是在线推测流程耗时，内存含模型权重和峰值 KV Cache",
      "source_locator": "Section 2.1-2.2, Table 1"
    }
  ],
  "evaluation_context": "训练在 SearchQA 或 ToolScale 上进行，评测覆盖三项 Agentic SearchQA 和两个 τ-bench 工具使用任务。主干为 Qwen3-4B 与 Qwen3.5-4B；每个 RL 设置 200 步、Agent/Speculator 组大小均为 8，训练分别使用 8 张 H100 或 8 张 H200。离线最终 Hit@1 在已完成轨迹的每个真实工具调用边界测量；环境始终只执行 Agent 的真实调用。",
  "limitations": "来源明确指出，推测执行只适合搜索、读取和查询等不改变外部状态的工具；订单、发消息或写数据库等有副作用的调用需要 dry-run、事务回滚、人工确认或禁用推测。评测只覆盖搜索问答和会话式 API，且主干仅为 4B 规模；跨域训练虽然提高 Hit@1，却会降低任务成功率。项目侧推断：论文没有测量真实并行预执行后的端到端节省、错误推测浪费的 I/O 成本或服务负载，因此 Hit@1 提升不能直接换算为任务时延下降。",
  "project_relevance": "项目推断：该方案直接对应 Agent 工具执行链加速，可在模型继续推理时提前发起低风险 Read、Search 或只读 API。工程验证应重点测精确调用命中率、工具延迟可隐藏比例、误推测成本、端到端 P95 时延和副作用隔离；代码 Agent 中只应先开放 read/grep/index 查询等幂等操作。",
  "primary_source_resolved": true,
  "quality_score": 93,
  "source_notes": [
    "原始来源为 arXiv:2607.25816v1。",
    "论文标题强调推测，但最终主表主要报告调用精确命中率与任务成功率，并未报告生产环境端到端加速。"
  ]
}