{
  "title": "InferScale：面向个性化LLLM服务的GPU原生KV注入",
  "event_hint": "InferScale GPU原生KV注入 复用记忆KV消除重复prefill 使TTFT与检索规模解耦",
  "problem": "生产记忆系统（Mem0、MemGPT、Zep）将检索到的记忆子集作为提示文本注入并在每次请求重新prefill，导致首Token时延随检索预算增长，即使底层记忆在多个请求间被复用；现有前缀缓存假设复用token占据固定位置，无法处理动态组装的记忆。",
  "mechanism": "InferScale以注意力层的KV注入替代token层提示注入：离线预计算每条记忆事实的KV表示并与语义嵌入一并驻留GPU，服务期仅检索相关事实并将其KV直接写入vLLM的分页缓存。核心两机制为Chunked RoPE（旋转前存储key、注入时按服务期位置旋转，保证任意位置注入与提示注入等价）与Context-Window Encoding（将每条事实与前若干轮上下文联合编码但只缓存目标事实KV），无需改引擎或微调，以vLLM KV-connector插件实现。",
  "evidence": [
    {
      "claim": "随检索从k=5增至k=50，Llama-3.1-8B的vLLM引擎TTFT仅上升4%（16.6ms→17.3ms），而Mem0上升106%（33.2ms→68.3ms）",
      "value": "4%",
      "baseline": "Mem0上升106%",
      "condition": "k=5至k=50，Llama-3.1-8B，LoCoMo",
      "source_locator": "chunk 3115655cfb5dc492789f542d-01.md，PDF Page 1 摘要与Page 2 Results"
    },
    {
      "claim": "在k=50时InferScale将TTFT降低72%-79%（3.6-4.8倍加速），跨三个开源模型一致",
      "value": "72%-79%",
      "baseline": "Mem0",
      "condition": "k=50",
      "source_locator": "chunk 3115655cfb5dc492789f542d-01.md，PDF Page 1-2"
    },
    {
      "claim": "在k=50的LoCoMo上InferScale准确率为60.3%，而Mem0为63.3%，无需服务期重算",
      "value": "60.3%",
      "baseline": "Mem0为63.3%",
      "condition": "k=50，LoCoMo",
      "source_locator": "chunk 3115655cfb5dc492789f542d-01.md，PDF Page 1-2 Results"
    },
    {
      "claim": "在100用户并发负载下InferScale吞吐是Mem0的3.7-4.5倍，呈近线性扩展",
      "value": "3.7-4.5x",
      "baseline": "Mem0",
      "condition": "100用户并发",
      "source_locator": "chunk 3115655cfb5dc492789f542d-01.md，PDF Page 2 Results"
    },
    {
      "claim": "将每会话KV存储（1.8-4.8GB）卸载到主机DRAM并按需经PCIe流式传输，k=50时仅给引擎TTFT增加约3ms，端到端query-to-first-token仍比Mem0快2.3倍",
      "value": "约3ms",
      "baseline": "Mem0端到端236ms",
      "condition": "k=50，Llama-3.1-8B，卸载到主机DRAM",
      "source_locator": "chunk 3115655cfb5dc492789f542d-01.md，PDF Page 2 Results"
    }
  ],
  "evaluation_context": "评测在LoCoMo基准上跨三个开源权重模型完成，主对比对象为Mem0（运行Qdrant精确搜索模式）；报告vLLM引擎TTFT、并发吞吐与准确率，并含把KV卸载到主机DRAM的端到端时延分解。",
  "limitations": "独立编码丢失相邻事实间的交互，准确率（60.3%）仍低于Mem0（63.3%）约3个百分点，仅靠Context-Window Encoding部分恢复；评测模型规模集中在8B级别，更大模型与更复杂记忆分布的泛化未在摘要中给出；Jasper向量索引与主机DRAM分层带来的容量/带宽边界需进一步量化。",
  "project_relevance": "直接属于AI Infra横向的推理服务与运行时优化：以GPU原生检索+KV注入把记忆条件化时延与检索上下文规模解耦，给出可复核的TTFT、吞吐与准确率权衡，对个性化/记忆增强LLM部署具有工程参考价值。",
  "primary_source_resolved": true,
  "quality_score": 86,
  "source_notes": [
    "arXiv原文（2607.27090v1）已抓取，摘要与正文一致，证据可在PDF Page 1-2定位。",
    "对比基线为Mem0，Qdrant运行于精确搜索模式，故索引选择主要影响时延而非准确率。"
  ]
}